{
  "$id": "https://developer-portfolio/interests-data-schema.json",
  "$schema": "http://json-schema.org/draft-07/schema#",
  "title": "Developer Portfolio Site Skills Data",
  "description": "Define the skills of the developer.",
  "type": "array",
  "minItems": 1,
  "maxItems": 999,
  "uniqueItems": true,
  "additionalProperties": false,
  "items": {
    "type": "object",
    "additionalProperties": false,
    "required": ["id", "level", "category", "skill", "description"],
    "properties": {
      "id": {
        "description": "A number to identify the individual interest.",
        "type": "integer"
      },
      "level": {
        "description": "The skill level.",
        "type": "string",
        "enum": ["Core", "Proficient", "Familiar"]
      },
      "category": {
        "description": "What category the skill comes under.",
        "type": "string",
        "minLength": 4,
        "maxLength": 64
      },
      "skill": {
        "description": "A brief description of the skill.",
        "type": "string",
        "minLength": 3,
        "maxLength": 64
      },
      "description": {
        "description": "A more detailed description of the skill.",
        "type": "string",
        "maxLength": 512
      }
    }
  }
}
